{
  "source": "sleeper",
  "league_id": "1386757318678433792",
  "season": 2026,
  "generated_at": "2026-10-27T13:00:00Z",
  "current_week": 8,
  "regular_season_max_week": 14,
  "playoff_rules": {
    "regular_season_max_week": 14,
    "playoff_slots": 6,
    "sixth_spot_rule": "points_for_outside_top_five",
    "bye_slots": 2,
    "standings_tiebreakers": [
      "win_pct",
      "points_for",
      "points_differential",
      "owner"
    ],
    "saunders_slots": 6
  },
  "update_context": {
    "mode": "manual",
    "cutoff_date": "2026-10-27",
    "contains_live_scores": false,
    "contains_projected_scores": false
  },
  "max_week": 17,
  "weeks_fetched": [
    1,
    2,
    3,
    4,
    5,
    6,
    7,
    8,
    9,
    10,
    11,
    12,
    13,
    14
  ],
  "teams": [
    {
      "roster_id": 1,
      "owner": "Zubs",
      "display_name": "zubinski",
      "sleeper_team_name": "The (St.) Browns"
    },
    {
      "roster_id": 2,
      "owner": "Plot",
      "display_name": "iplotnick",
      "sleeper_team_name": "Plot VanDam"
    },
    {
      "roster_id": 3,
      "owner": "Connor",
      "display_name": "ColdDecember",
      "sleeper_team_name": "The Civilians"
    },
    {
      "roster_id": 4,
      "owner": "Singer",
      "display_name": "Singnasty",
      "sleeper_team_name": "The Njigba-Wilson Xpress"
    },
    {
      "roster_id": 5,
      "owner": "Nuss",
      "display_name": "DrNuss",
      "sleeper_team_name": "Dr. Nuss"
    },
    {
      "roster_id": 6,
      "owner": "Joe",
      "display_name": "josephcarlhayne",
      "sleeper_team_name": "Joe-lene"
    },
    {
      "roster_id": 7,
      "owner": "Shap",
      "display_name": "ShapAttack",
      "sleeper_team_name": "Shap Daddy"
    },
    {
      "roster_id": 8,
      "owner": "Rishi",
      "display_name": "reesh13",
      "sleeper_team_name": "Rishi’s Raiders ☠️"
    },
    {
      "roster_id": 9,
      "owner": "Zook",
      "display_name": "mjzucker94",
      "sleeper_team_name": "Cool Hand Zook 🔫"
    },
    {
      "roster_id": 10,
      "owner": "Joel",
      "display_name": "JDenicoff29",
      "sleeper_team_name": "Crazy Feta Fighters"
    },
    {
      "roster_id": 11,
      "owner": "Shemer",
      "display_name": "ShemDawggg",
      "sleeper_team_name": ""
    },
    {
      "roster_id": 12,
      "owner": "Snare",
      "display_name": "Narrow",
      "sleeper_team_name": "Picken Moore Flowers"
    }
  ],
  "games": [
    {
      "season": 2026,
      "date": "2026-09-13",
      "teamA": "Connor",
      "teamB": "Shemer",
      "scoreA": 91.56,
      "scoreB": 92.26,
      "week": 1,
      "round": "",
      "type": "Regular",
      "status": "final",
      "matchup_id": 6,
      "rosterA": 3,
      "rosterB": 11
    },
    {
      "season": 2026,
      "date": "2026-09-13",
      "teamA": "Joe",
      "teamB": "Snare",
      "scoreA": 118.92,
      "scoreB": 164.36,
      "week": 1,
      "round": "",
      "type": "Regular",
      "status": "final",
      "matchup_id": 4,
      "rosterA": 6,
      "rosterB": 12
    },
    {
      "season": 2026,
      "date": "2026-09-13",
      "teamA": "Plot",
      "teamB": "Joel",
      "scoreA": 119.06,
      "scoreB": 99.54,
      "week": 1,
      "round": "",
      "type": "Regular",
      "status": "final",
      "matchup_id": 5,
      "rosterA": 2,
      "rosterB": 10
    },
    {
      "season": 2026,
      "date": "2026-09-13",
      "teamA": "Shap",
      "teamB": "Rishi",
      "scoreA": 98.86,
      "scoreB": 95.12,
      "week": 1,
      "round": "",
      "type": "Regular",
      "status": "final",
      "matchup_id": 2,
      "rosterA": 7,
      "rosterB": 8
    },
    {
      "season": 2026,
      "date": "2026-09-13",
      "teamA": "Singer",
      "teamB": "Zook",
      "scoreA": 111.94,
      "scoreB": 172.0,
      "week": 1,
      "round": "",
      "type": "Regular",
      "status": "final",
      "matchup_id": 1,
      "rosterA": 4,
      "rosterB": 9
    },
    {
      "season": 2026,
      "date": "2026-09-13",
      "teamA": "Zubs",
      "teamB": "Nuss",
      "scoreA": 106.4,
      "scoreB": 117.26,
      "week": 1,
      "round": "",
      "type": "Regular",
      "status": "final",
      "matchup_id": 3,
      "rosterA": 1,
      "rosterB": 5
    },
    {
      "season": 2026,
      "date": "2026-09-20",
      "teamA": "Connor",
      "teamB": "Joel",
      "scoreA": 112.18,
      "scoreB": 110.18,
      "week": 2,
      "round": "",
      "type": "Regular",
      "status": "final",
      "matchup_id": 6,
      "rosterA": 3,
      "rosterB": 10
    },
    {
      "season": 2026,
      "date": "2026-09-20",
      "teamA": "Nuss",
      "teamB": "Snare",
      "scoreA": 81.72,
      "scoreB": 82.04,
      "week": 2,
      "round": "",
      "type": "Regular",
      "status": "final",
      "matchup_id": 4,
      "rosterA": 5,
      "rosterB": 12
    },
    {
      "season": 2026,
      "date": "2026-09-20",
      "teamA": "Plot",
      "teamB": "Shemer",
      "scoreA": 135.72,
      "scoreB": 86.8,
      "week": 2,
      "round": "",
      "type": "Regular",
      "status": "final",
      "matchup_id": 5,
      "rosterA": 2,
      "rosterB": 11
    },
    {
      "season": 2026,
      "date": "2026-09-20",
      "teamA": "Shap",
      "teamB": "Zook",
      "scoreA": 107.38,
      "scoreB": 104.86,
      "week": 2,
      "round": "",
      "type": "Regular",
      "status": "final",
      "matchup_id": 1,
      "rosterA": 7,
      "rosterB": 9
    },
    {
      "season": 2026,
      "date": "2026-09-20",
      "teamA": "Singer",
      "teamB": "Rishi",
      "scoreA": 116.72,
      "scoreB": 59.12,
      "week": 2,
      "round": "",
      "type": "Regular",
      "status": "final",
      "matchup_id": 2,
      "rosterA": 4,
      "rosterB": 8
    },
    {
      "season": 2026,
      "date": "2026-09-20",
      "teamA": "Zubs",
      "teamB": "Joe",
      "scoreA": 122.26,
      "scoreB": 90.76,
      "week": 2,
      "round": "",
      "type": "Regular",
      "status": "final",
      "matchup_id": 3,
      "rosterA": 1,
      "rosterB": 6
    },
    {
      "season": 2026,
      "date": "2026-09-27",
      "teamA": "Joel",
      "teamB": "Shemer",
      "scoreA": 76.04,
      "scoreB": 90.54,
      "week": 3,
      "round": "",
      "type": "Regular",
      "status": "final",
      "matchup_id": 6,
      "rosterA": 10,
      "rosterB": 11
    },
    {
      "season": 2026,
      "date": "2026-09-27",
      "teamA": "Nuss",
      "teamB": "Joe",
      "scoreA": 119.28,
      "scoreB": 96.02,
      "week": 3,
      "round": "",
      "type": "Regular",
      "status": "final",
      "matchup_id": 4,
      "rosterA": 5,
      "rosterB": 6
    },
    {
      "season": 2026,
      "date": "2026-09-27",
      "teamA": "Plot",
      "teamB": "Connor",
      "scoreA": 113.46,
      "scoreB": 85.84,
      "week": 3,
      "round": "",
      "type": "Regular",
      "status": "final",
      "matchup_id": 5,
      "rosterA": 2,
      "rosterB": 3
    },
    {
      "season": 2026,
      "date": "2026-09-27",
      "teamA": "Rishi",
      "teamB": "Zook",
      "scoreA": 75.96,
      "scoreB": 92.18,
      "week": 3,
      "round": "",
      "type": "Regular",
      "status": "final",
      "matchup_id": 1,
      "rosterA": 8,
      "rosterB": 9
    },
    {
      "season": 2026,
      "date": "2026-09-27",
      "teamA": "Singer",
      "teamB": "Shap",
      "scoreA": 121.6,
      "scoreB": 121.08,
      "week": 3,
      "round": "",
      "type": "Regular",
      "status": "final",
      "matchup_id": 2,
      "rosterA": 4,
      "rosterB": 7
    },
    {
      "season": 2026,
      "date": "2026-09-27",
      "teamA": "Zubs",
      "teamB": "Snare",
      "scoreA": 84.54,
      "scoreB": 142.06,
      "week": 3,
      "round": "",
      "type": "Regular",
      "status": "final",
      "matchup_id": 3,
      "rosterA": 1,
      "rosterB": 12
    },
    {
      "season": 2026,
      "date": "2026-10-04",
      "teamA": "Connor",
      "teamB": "Shap",
      "scoreA": 111.32,
      "scoreB": 116.52,
      "week": 4,
      "round": "",
      "type": "Regular",
      "status": "final",
      "matchup_id": 4,
      "rosterA": 3,
      "rosterB": 7
    },
    {
      "season": 2026,
      "date": "2026-10-04",
      "teamA": "Joe",
      "teamB": "Rishi",
      "scoreA": 93.82,
      "scoreB": 95.26,
      "week": 4,
      "round": "",
      "type": "Regular",
      "status": "final",
      "matchup_id": 5,
      "rosterA": 6,
      "rosterB": 8
    },
    {
      "season": 2026,
      "date": "2026-10-04",
      "teamA": "Nuss",
      "teamB": "Joel",
      "scoreA": 146.02,
      "scoreB": 134.88,
      "week": 4,
      "round": "",
      "type": "Regular",
      "status": "final",
      "matchup_id": 3,
      "rosterA": 5,
      "rosterB": 10
    },
    {
      "season": 2026,
      "date": "2026-10-04",
      "teamA": "Plot",
      "teamB": "Singer",
      "scoreA": 118.32,
      "scoreB": 78.64,
      "week": 4,
      "round": "",
      "type": "Regular",
      "status": "final",
      "matchup_id": 2,
      "rosterA": 2,
      "rosterB": 4
    },
    {
      "season": 2026,
      "date": "2026-10-04",
      "teamA": "Shemer",
      "teamB": "Snare",
      "scoreA": 73.18,
      "scoreB": 109.82,
      "week": 4,
      "round": "",
      "type": "Regular",
      "status": "final",
      "matchup_id": 6,
      "rosterA": 11,
      "rosterB": 12
    },
    {
      "season": 2026,
      "date": "2026-10-04",
      "teamA": "Zubs",
      "teamB": "Zook",
      "scoreA": 108.7,
      "scoreB": 135.28,
      "week": 4,
      "round": "",
      "type": "Regular",
      "status": "final",
      "matchup_id": 1,
      "rosterA": 1,
      "rosterB": 9
    },
    {
      "season": 2026,
      "date": "2026-10-11",
      "teamA": "Connor",
      "teamB": "Rishi",
      "scoreA": 106.72,
      "scoreB": 107.86,
      "week": 5,
      "round": "",